{
  "id": "550e8400-e29b-41d4-a716-446655440000",
  "typ": "application/didcomm-plain+json",
  "type": "https://web-of-trust.de/protocols/space-invite/1.0",
  "from": "did:key:z6Mko3ZEjKJWQAM5nDXKoZ9jErvvxbWbYgS8KJXYpC5Hbu8a",
  "to": ["did:key:z6MkpTHR8VNsBxYAAWHut2Geadd9jSwuBV8xRoAnwWsdvktH"],
  "created_time": 1776945600,
  "body": {
    "spaceId": "7f3a2b10-4c5d-4e6f-8a7b-9c0d1e2f3a4b",
    "brokerUrls": ["wss://broker.example.com"],
    "currentKeyGeneration": 3,
    "spaceContentKeys": [{ "generation": 3, "key": "abc_123" }],
    "spaceCapabilitySigningKey": "def_456",
    "adminDids": ["did:key:z6Mko3ZEjKJWQAM5nDXKoZ9jErvvxbWbYgS8KJXYpC5Hbu8a"],
    "capability": "aaa.bbb.ccc"
  }
}
